#ID	text	majority	agreement	annotations
ABSA16-1431154:1.1	If you like spicy food get the <TARGET>chicken vindaloo</TARGET>.	neither	1.0	neither
ABSA16-NP#3:6.1	Prices are fair across the board for both <TARGET>food</TARGET> and bev.	positive	1.0	positive
ABSA16-1718513:3.1	THe <TARGET>back garden sitting area</TARGET> is very pleasant, where you can see their personal herb garden.	positive	1.0	positive
ABSA16-1718513:0.1	We went here for lunch a couple of weeks ago on a Saturday, and I was thoroughly impressed with the <TARGET>food</TARGET>.	positive	1.0	positive
ABSA16-PP#4:7.1	The <TARGET>potato balls</TARGET> were not dry at all... in fact it was buttery.	positive	1.0	positive
ABSA16-WE#1:4.1	The <TARGET>pasta</TARGET> was well cooked, didn't have enough sauce though or flavor.	neither	1.0	neither
ABSA16-Z#6:1.2	This is undoubtedly my favorite <TARGET>modern Japanese brasserie</TARGET> (that don’t serve sushi), and in my opinion, one of the most romantic restaurants in the city!	positive	1.0	positive,positive
ABSA16-EVPK#9:0.1	cirspy crust <TARGET>margherita pizza</TARGET>	positive	1.0	positive,positive
ABSA16-RL#3:3.1	its just a fun place to go, not a five star <TARGET>restaraunt</TARGET>.	positive	1.0	positive,positive
ABSA16-1655504:2.1	The large selection of <TARGET>bruschettas</TARGET>, paninis, tramezzinis keep the palate from stagnating.	positive	1.0	positive
ABSA16-1367358:2.2	Pizza is terrific, as is <TARGET>homemade pasta</TARGET>.	negative	1.0	negative
ABSA16-TR#2:3.1	The <TARGET>bar drinks</TARGET> were Eh, ok to say the least.	neither	0.5	neither,negative
ABSA16-611117:3.1	It was the first place we ate on our first trip to New York, and it will be the last <TARGET>place</TARGET> we stop as we head out of town on our next trip to New York.	negative	1.0	negative
ABSA16-624715:2.1	<TARGET>People</TARGET> are always friendly.	positive	1.0	positive
ABSA16-1225162:0.1	<TARGET>Raga's</TARGET> is a romantic, cozy restaurant.	positive	1.0	positive
ABSA16-DBG#2:8.1	My main concern was the sanity of the <TARGET>food</TARGET> that was being sent out to myself and others, but I would be lying is I said that as someone who has worked in restaurants since the age of fifteen I was expecting at least a minimal effort on the part of the restaurant to amend the situation.	negative	1.0	negative
ABSA16-735448:2.1	good <TARGET>music</TARGET>, great food, speedy service affordable prices.	positive	1.0	positive
ABSA16-1347423:1.1	The <TARGET>staff</TARGET> was accomodating, the food was absolutely delicious and the place is lovely.	positive	1.0	positive
ABSA16-1573534:0.1	First of all <TARGET>Dal Bukhara</TARGET> Rocks.	positive	0.6666666666666666	reject,positive,positive
ABSA16-1119578:1.1	The <TARGET>pizza</TARGET> is overpriced and soggy.	negative	1.0	negative
ABSA16-1398844:4.1	<TARGET>Service</TARGET> is not what one would expect from a joint in this price category.	negative	1.0	negative
ABSA16-NP#3:2.1	Noodle pudding is exactly the type of <TARGET>service</TARGET> and food I enjoy.	positive	1.0	positive
ABSA16-TFS#2:1.2	The food is great and the <TARGET>environment</TARGET> is even better.	positive	1.0	positive
ABSA16-Z#10:2.1	The <TARGET>food</TARGET> was great and tasty, but the sitting space was too small, I don't like being cramp in a corner.	negative	1.0	negative
ABSA16-615180:1.2	The food was not fresh, the <TARGET>sauces</TARGET> were bland and very oily.	negative	1.0	negative
ABSA16-1661043:5.1	<TARGET>Service</TARGET> is average.	neither	1.0	neither
ABSA16-503807:6.2	The <TARGET>restaurant</TARGET> is a bit noisy but that is something that can be overlooked once you sit down and enjoy a great meal	positive	1.0	positive
ABSA16-430342:5.1	Even if the food wasn't this good, the <TARGET>garden</TARGET> is a great place to sit outside and relax.	neither	1.0	neither
ABSA16-Y#9:3.2	One <TARGET>special roll</TARGET> and one regular roll is enough to fill you up, but save room for dessert!	positive	1.0	positive
ABSA16-519425:2.1	The <TARGET>lamb</TARGET> was tender so full of flavor, the dessert was divine!!	positive	1.0	positive
ABSA16-TFS#5:27.1	If you are going for the <TARGET>food</TARGET>, it will not be worth it.	negative	1.0	negative
ABSA16-494850:3.1	The <TARGET>food</TARGET> now is inconsistent.	negative	1.0	negative
ABSA16-720620:8.1	<TARGET>Big Wong</TARGET> is a great place to eat and fill your stomach.	positive	1.0	positive
ABSA16-BG#5:4.1	I have it a 4 instead of 5 because of the price (just chicken tikka masala - no bread of rice - is $25), which I would expect at a upscale Indian restaurant but this <TARGET>place</TARGET> doesn't have an upscale feel.	negative	1.0	negative,negative
ABSA16-Y#6:4.3	The rolls are creative and I have yet to find another sushi place that serves up more inventive yet delicious <TARGET>japanese food</TARGET>.	positive	1.0	positive
ABSA16-1661043:2.1	You should pass on the <TARGET>calamari</TARGET>.	negative	1.0	negative
ABSA16-TFS#11:3.3	Rather than preparing <TARGET>vegetarian dish</TARGET>, the chef presented me with a plate of steamed vegetables (minus sauce, seasoning, or any form or aesthetic presentation).	negative	1.0	negative
ABSA16-CLF#5:1.1	Stepping into <TARGET>Casa La Femme</TARGET> last night was a true experience unlike any other in New York!	positive	1.0	positive
ABSA16-P#9:2.2	The drinks are great, especially when made by <TARGET>Raymond</TARGET>.	positive	1.0	positive,positive,positive
ABSA16-535171:1.1	Not the typical NYC gimmick theme <TARGET>restaurant</TARGET>.	negative	1.0	negative
ABSA16-BFC#9:6.1	There was no tap <TARGET>beer</TARGET> that evening, which was a disappointment. 	negative	1.0	negative
ABSA16-461928:1.1	The <TARGET>pizza</TARGET> is delicious and the proprietor is one of the nicest in NYC.	positive	1.0	positive,positive
ABSA16-630914:2.3	The mussles were the fishiest things I've ever tasted, the seabass was bland, the <TARGET>goat cheese salad</TARGET> was missing the goat cheese, the penne w/ chicken had bones in it... It was disgusting.	negative	1.0	negative
ABSA16-1145510:1.2	The pizza is yummy and I like the <TARGET>atmoshpere</TARGET>.	negative	1.0	negative
ABSA16-1014458:2.2	The <TARGET>duck confit</TARGET> is always amazing and the foie gras terrine with figs was out of this world.	positive	1.0	positive,positive,positive
ABSA16-EVPK#10:0.1	Super YUMMY <TARGET>Pizza</TARGET>!	positive	1.0	positive
ABSA16-1102681:2.1	The <TARGET>food</TARGET> was average to above-average; the French Onion soup filling yet not overly impressive, and the desserts not brilliant in any way.	neither	0.5	neither,negative
ABSA16-1286916:4.1	You cannot go wrong at the <TARGET>Red Eye Grill</TARGET>.	positive	1.0	positive
ABSA16-1227999:1.1	The <TARGET>waitress</TARGET> moved our table practically into the bathroom and when we asked to cancel our dinner orders because we did not want to eat sitting on the toilet, we were told no...	negative	1.0	negative
ABSA16-378848:1.2	The first time the <TARGET>sushi</TARGET> was outstanding, the second time it was a little bland.	negative	0.5	negative,neither
ABSA16-527109:0.1	Volare virgins or weekly regulars, everyone gets treated the same and you can't ask for more than that when the <TARGET>service</TARGET> is this friendly.	positive	1.0	positive
ABSA16-610611:1.2	stick with the chicken, <TARGET>beef</TARGET>, and lamb dishes.	positive	1.0	positive,positive
ABSA16-TR#5:2.1	The <TARGET>food</TARGET> tasted very good.	positive	1.0	positive
ABSA16-1496205:5.1	The <TARGET>service</TARGET> is ok, some of the people didn't get what they asked for.	negative	1.0	negative
ABSA16-430342:1.1	Kind, attentive <TARGET>wait staff</TARGET>.	positive	1.0	positive
ABSA16-BzG#4:3.1	All the various <TARGET>Greek and Cypriot dishes</TARGET> are excellent, but the gyro is the reason to come--if you don't eat one your trip was wasted.	neither	1.0	neither
ABSA16-WE#4:6.1	Thank you everyone at <TARGET>Water's Edge</TARGET>.	positive	1.0	positive
ABSA16-1706644:1.2	I found the food to be outstanding, particulary the <TARGET>salmon dish</TARGET> I had.	positive	1.0	positive,positive
ABSA16-433878:3.1	The <TARGET>counter service</TARGET> is bad.	negative	1.0	negative,negative
ABSA16-BG#5:7.1	But if you're prepared to spend some $ and remember to ask if something they offer is complimentary, then this is the place to go for <TARGET>Indian food</TARGET>	positive	1.0	positive
ABSA16-FF#3:6.1	I took one look at the <TARGET>chicken</TARGET> and I was appalled.	positive	1.0	positive
ABSA16-1340075:1.3	They have it all -- great price, <TARGET>food</TARGET>, and service.	positive	1.0	positive,positive
ABSA16-430342:0.3	delicious simple food in nice <TARGET>outdoor atmosphere</TARGET>.	positive	1.0	positive
ABSA16-1221938:1.1	Try their <TARGET>chef's specials</TARGET>-- they are to die for.	positive	1.0	positive
ABSA16-BzG#1:0.1	The <TARGET>Cypriot restaurant</TARGET> has a lot going for it.	positive	1.0	positive
ABSA16-1340075:4.2	And it all comes at a very reasonable price (<TARGET>congee</TARGET>, noodles, and rice dishes are no more than $3-6 each).	positive	1.0	positive
ABSA16-BzG#4:2.1	What really makes it shine is the <TARGET>food</TARGET>, which is aggressively seasoned with Cyrpriot spices, and all made in-house (even the gyro meat and sausages), and made of much higher quality ingredients that might otherwise be expected.	positive	1.0	positive,positive
ABSA16-1457607:2.1	The <TARGET>characters</TARGET> really make for an enjoyable experience.	positive	1.0	positive,positive
ABSA16-1341354:2.2	We both opted for a <TARGET>pasta dish</TARGET> and they were served timely and fresh.	positive	1.0	positive
ABSA16-493013:0.1	<TARGET>Suan</TARGET> is a great place that I often take my friends (classmates) too.	positive	1.0	positive,positive
ABSA16-1016296:5.1	I/we will never go back to this <TARGET>place</TARGET> again.	negative	1.0	negative
ABSA16-1280166:3.1	<TARGET>Wine list selection</TARGET> is good and wine-by-the-glass was generously filled to the top.	positive	1.0	positive
ABSA16-1586174:4.2	limited menu, no-so-fresh <TARGET>ingredients</TARGET>, thinly-sliced fish, fall-apart rice. 	negative	1.0	negative
ABSA16-1167434:5.2	those <TARGET>rolls</TARGET> were big, but not good and sashimi wasn't fresh.	negative	1.0	negative
ABSA16-1032695:0.1	Every time in New York I make it a point to visit <TARGET>Restaurant Saul</TARGET> on Smith Street.	positive	1.0	positive
ABSA16-1723658:1.1	Great <TARGET>food</TARGET>, good size menu, great service and an unpretensious setting.	positive	1.0	positive
ABSA16-496132:4.1	if you're daring, try the <TARGET>balsamic vinegar over icecream</TARGET>, it's wonderful!	positive	1.0	positive
ABSA16-1398844:6.1	Somehow working the italian charm with constant mille grazie does not constitute proper <TARGET>service</TARGET>.	negative	1.0	negative
ABSA16-1626564:1.1	<TARGET>Food</TARGET> is excellent.	positive	1.0	positive
ABSA16-1506491:2.1	Check out the secret <TARGET>back room</TARGET>.	neither	1.0	neither,neither
ABSA16-1357554:3.2	Service was slow, but the <TARGET>people</TARGET> were friendly.	neither	1.0	neither
ABSA16-1451107:6.1	The <TARGET>staff</TARGET> was the friendliest that have seen in New York.	positive	1.0	positive,positive,positive
ABSA16-682391:0.1	Best <TARGET>drumsticks over rice</TARGET> and sour spicy soup in town!	positive	1.0	positive
ABSA16-608500:3.2	We ordered the <TARGET>chicken casserole</TARGET>, but what we got were a few small pieces of chicken, all dark meat and on the bone.	negative	1.0	negative
ABSA16-507844:0.1	This place would be so much better served by being run by a group that actually understands <TARGET>customer service</TARGET>.	negative	1.0	negative
ABSA16-NP#10:3.1	The <TARGET>veal</TARGET> was incredible last night.	positive	1.0	positive
ABSA16-1457607:5.1	However, I think <TARGET>Jeckll and Hydes</TARGET> t is one of those places that is fun to do once.	positive	1.0	positive
ABSA16-CLF#4:1.1	I'll being with a couple of positives: cool <TARGET>decor</TARGET>, good pita and hummus, and grilled octopus that was actually pretty tasty.	positive	1.0	positive
ABSA16-1632929:3.4	The food was delicious (I had a halibut special, my husband had steak), and the <TARGET>service</TARGET> was top-notch.	positive	1.0	positive
ABSA16-1713185:3.1	If you want good authentic <TARGET>Thai</TARGET> this place is not the place to go.	positive	0.5	positive,negative
ABSA16-717570:4.2	You must have the crabmeat lasagna which is out of this world and the <TARGET>chocolate bread pudding</TARGET> for dessert.	positive	1.0	positive
ABSA16-1561259:2.1	The <TARGET>hostess</TARGET> and the waitress were incredibly rude and did everything they could to rush us out.	negative	1.0	negative
ABSA16-957145:1.2	I have been coming here for years and have nothing but good things to say about the service and the great <TARGET>staff</TARGET> at La Lanterna.	positive	1.0	positive
ABSA16-NP#10:2.1	Great <TARGET>food</TARGET>, amazing service, this place is a class act.	positive	1.0	positive
ABSA16-512294:0.1	Great <TARGET>food</TARGET>, great prices, great service.	positive	1.0	positive
ABSA16-ADLT#6:2.2	The food and <TARGET>service</TARGET> were fine, however the maitre-D was incredibly unwelcoming and arrogant.	negative	0.5	negative,positive
ABSA16-1126814:0.3	Leon is an East Village gem: casual but hip, with well prepared basic French bistro fare, good <TARGET>specials</TARGET>, a warm and lively atmosphere.	positive	1.0	positive
ABSA16-511290:4.2	This place has the the correct ambience and an excellent <TARGET>staff</TARGET> to make you feel like a guest and a friend at the same time.	positive	1.0	positive,positive
ABSA16-558423:4.2	However, if you want great food at a great price and don't mind the <TARGET>decor</TARGET>, you can't beat this place.	positive	1.0	positive
ABSA16-1413697:3.1	I highly recommend to anyone to give this <TARGET>place</TARGET> a try.	positive	1.0	positive
ABSA16-611117:0.1	Best <TARGET>Reuben sandwich</TARGET> ever!	positive	1.0	positive,positive
ABSA16-1413697:2.1	The place is so cool and the <TARGET>service</TARGET> is prompt and curtious.	positive	1.0	positive,positive
ABSA16-TR#3:1.1	There is something about their <TARGET>atmosphere</TARGET> that makes me come back nearly every week.	positive	1.0	positive,positive
ABSA16-485966:1.1	The <TARGET>place</TARGET> was quiet and delightful.	positive	1.0	positive
ABSA16-P#10:2.2	My <TARGET>quesadilla</TARGET> tasted like it had been made by a three-year old with no sense of proportion or flavor.	negative	1.0	negative
ABSA16-1225162:3.1	The <TARGET>staff</TARGET> is incredibly helpful and attentive.	positive	1.0	positive,positive
ABSA16-1367358:3.2	Ambience is delightful, <TARGET>service</TARGET> impeccable.	positive	1.0	positive
ABSA16-872763:4.1	There is a downside if you're ordering in -- the <TARGET>delivery guys</TARGET> have MAJOR attitude.	negative	1.0	negative
ABSA16-EVPK#4:4.1	Personally I like the <TARGET>margherita pizza</TARGET> better, but they are all good.	positive	1.0	positive
ABSA16-1303984:3.2	The scallion pancakes and <TARGET>fried dumplings</TARGET> were nothing out of the ordinary.	negative	1.0	negative
ABSA16-1338124:5.1	In any event, this is a <TARGET>place</TARGET> I'll be sure to stop by again when I'm in this part of town.	positive	1.0	positive
ABSA16-BG#5:3.2	Very "normal <TARGET>Indian food</TARGET>", but done really well.	positive	1.0	positive
ABSA16-1707741:3.1	<TARGET>Service</TARGET> was also very good.	positive	1.0	positive
ABSA16-1338124:0.1	This is some really good, inexpensive <TARGET>sushi</TARGET>.	positive	1.0	positive,positive
ABSA16-1506491:0.3	I have known about this secret for the last 13 years, Emilio(the Godfather) has continued to serve <TARGET>food</TARGET> and wine for the gods at mortal prices.	positive	1.0	positive,positive
ABSA16-BFC#7:7.1	I'd be horrified if my <TARGET>staff</TARGET> were turning away customers so early and so rudely!	positive	1.0	positive
ABSA16-BFC#7:4.1	As <TARGET>BFC</TARGET> doesn't take reservations you almost always have to wait by the bar - and be abused by the front of house staff until you are seated, which can be over an hour later!	negative	1.0	negative
ABSA16-1303888:0.1	All the <TARGET>staff</TARGET> is absolutely professional!! 	positive	1.0	positive
ABSA16-ADLT#3:3.2	Wish NY had more of these kind of places: intimate, superb <TARGET>food</TARGET>, homey, top notch all the way around, certainly worth the wait.	positive	1.0	positive
ABSA16-1118167:2.1	The <TARGET>pizza</TARGET> was delivered cold and the cheese wasn't even fully melted!	negative	1.0	negative,negative
ABSA16-1004293:1.1	We, there were four of us, arrived at noon - the place was empty - and the <TARGET>staff</TARGET> acted like we were imposing on them and they were very rude.	negative	1.0	negative
ABSA16-1199292:3.1	I take all my NYC guests to <TARGET>VT's</TARGET>.	neither	1.0	neither
ABSA16-1748839:7.1	For the people who want great <TARGET>food</TARGET> plus great service, Roxy is a place to AVOID!	negative	1.0	negative
ABSA16-1028246:1.2	Service was devine, <TARGET>oysters</TARGET> where a sensual as they come, and the price can't be beat!!!	positive	1.0	positive
ABSA16-BG#8:3.2	The <TARGET>lunch buffet</TARGET> is expensive but is deff worth it.	positive	1.0	positive
ABSA16-CLF#4:1.4	I'll being with a couple of positives: cool decor, good pita and hummus, and <TARGET>grilled octopus</TARGET> that was actually pretty tasty.	positive	1.0	positive
ABSA16-1451109:2.2	The food was pretty tradional but it was hot and good with large <TARGET>portions</TARGET>.	positive	1.0	positive
ABSA16-CLF#3:18.1	We also asked for Hooka six times and the <TARGET>waiter</TARGET> kept telling us one minute and never returning with the Hooka.	negative	1.0	negative
ABSA16-553097:4.1	But that wasn't the icing on the cake: a <TARGET>tiramisu</TARGET> that resembled nothing I have ever had.	positive	1.0	positive
ABSA16-955711:1.1	The <TARGET>wine list</TARGET> is extensive and impressive.	positive	1.0	positive
ABSA16-1055910:2.1	<TARGET>Food</TARGET>-awesome.	positive	1.0	positive
ABSA16-1398844:0.1	First of all, this <TARGET>place</TARGET> is *not* romantic, as claimed by Citysearch's editorial review.	negative	1.0	negative
ABSA16-Z#6:2.2	Not only is it an adventure getting to this somewhat hidden spot, once you enter the <TARGET>unmarked wooden doors</TARGET>, the zen and intimate décor will make you feel like you’re no longer in the city.	positive	1.0	positive
ABSA16-1062641:2.1	<TARGET>Food</TARGET> is great.	positive	1.0	positive
ABSA16-FF#3:0.1	How is this <TARGET>palce</TARGET> still open?	negative	1.0	negative
ABSA16-Z#11:6.1	I've enjoyed 99% of the <TARGET>dishes</TARGET> we've ordered with the only exceptions being the occasional too-authentic-for-me dish (I'm a daring eater but not THAT daring).	positive	1.0	positive
ABSA16-759781:4.2	The vibe is very relaxed and cozy, <TARGET>service</TARGET> was great and the food was excellent!	positive	1.0	positive
ABSA16-746254:4.4	With so many good restaurants on the UWS, I don't need overpriced food, absurdly arrogant wait-staff who don't recognize they work at a glorified diner, clumsy service, and <TARGET>management</TARGET> that doesn't care.	negative	1.0	negative
ABSA16-519425:4.1	The <TARGET>place</TARGET> itself is beautiful the bar scene seems to be happening.	positive	1.0	positive
ABSA16-TFS#10:9.3	All in all, I would return - as it was a beautiful restaurant - but I hope the <TARGET>staff</TARGET> pays more attention to the little details in the future.	negative	1.0	negative,negative
ABSA16-1543345:1.1	Who has room for Cheesesticks with the best <TARGET>pizza</TARGET> in NYC!	positive	1.0	positive
ABSA16-1167434:5.3	those rolls were big, but not good and <TARGET>sashimi</TARGET> wasn't fresh.	negative	1.0	negative
ABSA16-1661043:0.1	<TARGET>Pizza</TARGET> here is consistently good.	positive	1.0	positive
ABSA16-BFC#9:19.1	I heard the <TARGET>lobster roll</TARGET> was excellent. 	positive	1.0	positive
ABSA16-630914:2.4	The mussles were the fishiest things I've ever tasted, the seabass was bland, the goat cheese salad was missing the goat cheese, the <TARGET>penne w/ chicken</TARGET> had bones in it... It was disgusting.	negative	1.0	negative
ABSA16-BFC#9:5.1	The <TARGET>menu</TARGET> is fairly simple without much descriptions. 	neither	1.0	neither
ABSA16-737999:2.2	Always good drinks and <TARGET>service</TARGET> is pretty good;	positive	1.0	positive,positive
ABSA16-630914:3.2	Nice atmosphere, the <TARGET>service</TARGET> was very pleasant and the desert was good.	positive	1.0	positive
ABSA16-BHD#7:3.2	amazing fun for <TARGET>hot dog</TARGET> lovers of all ages PLEASE do yourself a favor and check this place out!!!!	positive	1.0	positive
ABSA16-1189674:3.2	Admittedly some nights inside the <TARGET>restaurant</TARGET> were rather warm, but the open kitchen is part of the charm.	positive	1.0	positive
ABSA16-1706644:4.2	We ate out in the back patio, which is worth it as it's cool and the <TARGET>music</TARGET> is hear well there.	positive	1.0	positive,positive
ABSA16-378848:3.3	The blond wood decor is very soothing, the premium sake is excellent and the <TARGET>service</TARGET> is great.	positive	1.0	positive
ABSA16-1205520:0.1	I'm not sure where the other reviewers ate but it seems as if we visited two different restaurants because my friends and I all enjoy <TARGET>Mizu</TARGET> very much... and we're repeat customers.	positive	1.0	positive
ABSA16-NP#3:5.1	This is the first place I've been that a <TARGET>runner</TARGET> remembers my order... hope he likes his job because I have half a mind to steal him for my restaurant.	positive	1.0	positive
ABSA16-WE#1:3.3	The bread was stale, the <TARGET>salad</TARGET> was overpriced and empty.	negative	1.0	negative
ABSA16-Z#11:5.1	The <TARGET>food</TARGET> is all shared so we get to order together and eat together.	neither	1.0	neither
ABSA16-1439875:1.2	The <TARGET>place</TARGET> is small and intimate and you may feel a little crowded, but the service is excellent and it's great for friends out, a romantic date, or a special occassion.	positive	1.0	positive
ABSA16-Z#6:9.2	I picked the Grilled Black Cod as my entree, which I absolutely devoured while someone commented that the <TARGET>Grilled Salmon dish</TARGET> was better.	positive	1.0	positive
ABSA16-1300636:3.1	Other guests enjoyed <TARGET>pizza</TARGET>, santa fe chopped salad and fish and chips.	positive	1.0	positive
ABSA16-1335656:2.1	<TARGET>Ambience</TARGET> is so cute and quaint, good for business although we were there on vacation.	positive	1.0	positive
ABSA16-1395421:1.4	THe Pizza and wine were excellent-the service too--but what really MADE this place was the <TARGET>backyard dining area</TARGET>.	positive	1.0	positive
ABSA16-1719567:4.1	We waited at the bar and had <TARGET>martinis</TARGET> that were just right.	positive	1.0	positive
ABSA16-1606837:2.1	The <TARGET>service</TARGET> was attentive.	positive	1.0	positive
ABSA16-TFS#5:8.2	Yes, the <TARGET>place</TARGET> is classy and beautiful, but they most certainly target the uber whealthy Not the common joe that wants to go all out every once in a while.	positive	1.0	positive
ABSA16-ADLT#10:6.1	great <TARGET>food</TARGET>, great wine list, great service in a great neighborhood...	positive	1.0	positive
ABSA16-BFC#7:11.1	Considering you will spend at least $60 a head, I expect better <TARGET>service</TARGET>. 	negative	1.0	negative
ABSA16-632121:2.2	The food is amazing, rich <TARGET>pastas</TARGET> and fresh doughy pizza.	positive	1.0	positive
ABSA16-NP#4:2.1	The <TARGET>menu</TARGET> looked great, and the waiter was very nice, but when the food came, it was average.	positive	1.0	positive
ABSA16-521916:1.1	Small servings for main entree, i had <TARGET>salmon</TARGET> (wasnt impressed) girlfriend had chicken, it was good.	negative	1.0	negative
ABSA16-CLF#3:28.1	By the time we left our wallets were empy and so were our stomachs AND we missed the show we were supposed to see following our dinner, which would have been acceptable if we got to enjoy the experience of good <TARGET>food</TARGET> and belly dancers!	neither	1.0	neither
ABSA16-1341354:3.2	We concluded with tiramisu <TARGET>chocolate cake</TARGET>, both were delicious.	positive	1.0	positive
ABSA16-558423:4.3	However, if you want great <TARGET>food</TARGET> at a great price and don't mind the decor, you can't beat this place.	positive	1.0	positive
ABSA16-720620:3.1	This <TARGET>dish</TARGET> is my favorite and I always get it when I go there and never get tired of it.	positive	1.0	positive,positive
ABSA16-449802:5.1	But who says Murray's is anything about <TARGET>service</TARGET>.	neither	1.0	neither
ABSA16-1119578:1.2	The <TARGET>pizza</TARGET> is overpriced and soggy.	negative	1.0	negative,negative
ABSA16-P#10:9.1	Oh, and I never write reviews--I just was so moved by how bad this <TARGET>place</TARGET> was, I felt it was my duty to spread the word.	negative	1.0	negative
ABSA16-1586174:0.1	honestly the worst <TARGET>sushi</TARGET> my husband and i had in our entire lives.	negative	1.0	negative
ABSA16-735448:3.1	even the <TARGET>wine by the glass</TARGET> was good.	positive	1.0	positive
ABSA16-511290:4.1	This place has the the correct <TARGET>ambience</TARGET> and an excellent staff to make you feel like a guest and a friend at the same time.	positive	1.0	positive
ABSA16-1730447:3.3	The crust is thin, the <TARGET>ingredients</TARGET> are fresh and the staff is friendly.	positive	1.0	positive
ABSA16-929329:3.4	Interesting <TARGET>selection</TARGET>, good wines, service fine, fun decor.	positive	1.0	positive,positive
ABSA16-445960:3.3	The food is good, especially their more basic dishes, and the <TARGET>drinks</TARGET> are delicious.	positive	1.0	positive,positive
ABSA16-1289424:4.1	The place's <TARGET>decor</TARGET> and hidden bathrooms made for a good laugh.	positive	1.0	positive
