#ID	text	majority	agreement	annotations
ABSA16-BzG#2:1.2	The <TARGET>food</TARGET> is flavorful, plentiful and reasonably priced.	positive	1.0	positive,positive
ABSA16-1655504:2.2	The large selection of bruschettas, <TARGET>paninis</TARGET>, tramezzinis keep the palate from stagnating.	neither	1.0	neither
ABSA16-Z#6:12.1	For desserts, we tried the <TARGET>frozen black sesame mousse</TARGET> (interesting but not extraordinary) and matcha (powdered green tea) and blueberry cheesecake, which was phenomenal.	neither	0.5	neither,positive
ABSA16-1286916:1.1	The first time I went, and was completely taken by the <TARGET>live jazz band</TARGET> and atmosphere, I ordered the Lobster Cobb Salad.	neither	1.0	neither
ABSA16-BHD#4:4.1	Going to <TARGET>Bark</TARGET> is always worth the train ride, and will make your tongue and belly very happy!	positive	1.0	positive,positive,positive
ABSA16-1730014:2.3	Guacamole+shrimp appetizer was really great, we both had the filet, very good, didn't much like the <TARGET>frites</TARGET> that came with, but the filet was so good, neither of us cared.	negative	0.6666666666666666	negative,neither,negative
ABSA16-1632445:3.1	The <TARGET>service</TARGET> is good and ambience is good for a date or group outing.	positive	1.0	positive
ABSA16-TM#7:0.2	Excellent <TARGET>food</TARGET> for great prices	positive	1.0	positive,positive
ABSA16-1611489:1.1	Also, the <TARGET>sandwiches</TARGET> (nearing $7) didn't come with anything like chips or a side.	negative	1.0	negative
ABSA16-PP#4:2.1	The <TARGET>service</TARGET> was quick and friendly.	positive	1.0	positive,positive
ABSA16-TM#4:2.1	The <TARGET>chicken lollipop</TARGET> is my favorite, most of the dishes (I have to agree with a previous reviewer) are quite oily and very spicy, espeically the Chilli Chicken.	neither	1.0	neither
ABSA16-TFS#5:25.2	All in all, the food was great (except for the <TARGET>dessserts</TARGET>).	negative	1.0	negative
ABSA16-773720:2.2	Although they do the typical what kind of water would you like questions the service was good and overall very relaxing to <TARGET>place</TARGET> to eat.	positive	1.0	positive,positive
ABSA16-1448587:3.1	The <TARGET>decor</TARGET> in this place is very diner-ish and the kind of place you expect in the East Village - not romantic, just simple, small and sparse.	positive	0.5	positive,neither
ABSA16-433878:0.3	This is a nice <TARGET>pizza place</TARGET> with good selection of thin crust pizza including the Basil slice.	positive	1.0	positive,positive
ABSA16-404464:2.2	The <TARGET>entree</TARGET> was bland and small, dessert was not inspired.	negative	1.0	negative
ABSA16-1623276:1.1	The <TARGET>food</TARGET> is tasty and portion sizes are appropriate.	positive	1.0	positive,positive,positive,positive
ABSA16-ADLT#3:2.1	This <TARGET>establishment</TARGET> is the real deal. 	positive	0.5	positive,neither
ABSA16-433878:1.1	Their <TARGET>calzones</TARGET> are horrific, bad, vomit-inducing, YUCK.	negative	1.0	negative
ABSA16-DBG#1:0.1	Dokebi gives Williamsburg the right one-two punch of classic <TARGET>Korean food</TARGET> and fusion twists like pork belly tacos.	neither	1.0	neither
ABSA16-1586174:5.2	the only things u could really taste are the very salty soy sauce (even its low sodium), the vinegar-soaked <TARGET>rice</TARGET>, and the scallion on top of the fish. 	negative	0.6666666666666666	neither,negative,negative
ABSA16-1746113:3.1	The <TARGET>fish</TARGET> was really,really fresh.	positive	1.0	positive,positive
ABSA16-TM#5:3.2	Helpful service and average price per <TARGET>dish</TARGET> $10.	positive	0.6666666666666666	positive,positive,neither
ABSA16-BFC#7:8.1	There's another <TARGET>girl</TARGET> who I can't describe, she is about 5'6" with brown hair, who eavesdrops on your conversation and chimes in - except she only hears the last part of what you said, so her uninvited opinions are often out of context and nothing to do with what you're *really* talking about. 	negative	1.0	negative
ABSA16-476473:0.1	Awsome <TARGET>Pizza</TARGET> especially the Margheritta slice.	positive	1.0	positive
ABSA16-P#7:2.1	The <TARGET>atmosphere</TARGET> was great.	positive	1.0	positive
ABSA16-Z#5:4.2	The atmosphere was pretty nice but had a bit lacking, which it tries to make up for with a crazy <TARGET>scheme of mirrors</TARGET>.	negative	1.0	negative
ABSA16-1623276:0.1	Patroon features a nice <TARGET>cigar bar</TARGET> and has great staff.	positive	1.0	positive
ABSA16-CLF#8:2.1	Had an awful experience at <TARGET>Casa la Femme</TARGET> on a Saturday dinner.	negative	1.0	negative
ABSA16-Z#9:6.3	So what you really end up paying for is the restaurant not the <TARGET>food</TARGET>.	neither	1.0	neither
ABSA16-1661043:4.1	<TARGET>Decor</TARGET> is charming.	positive	1.0	positive
ABSA16-RL#3:1.1	im not necessarily fanatical about this <TARGET>place</TARGET>, but it was a fun time for low pirces.	neither	1.0	neither
ABSA16-1543345:2.2	Get the pepperoni - YUM - and a <TARGET>family style salad</TARGET>.	neither	0.5	neither,positive
ABSA16-1162037:2.1	The <TARGET>atmosphere</TARGET> isn't the greatest , but I suppose that's how they keep the prices down .	negative	0.6666666666666666	negative,negative,neither
ABSA16-1543345:2.1	Get the <TARGET>pepperoni</TARGET> - YUM - and a family style salad.	positive	1.0	positive
ABSA16-DBG#7:4.1	The <TARGET>bibimbap</TARGET> was average, but the stone bowl wasn't even close to sizzling.	neither	0.6666666666666666	neither,neither,negative
ABSA16-447697:2.1	Unique <TARGET>apppetizers</TARGET>.	positive	1.0	positive
ABSA16-1649025:2.1	The <TARGET>food</TARGET> is so cheap and the waiters are nice.	positive	1.0	positive
ABSA16-1138996:3.1	As always we had a great <TARGET>glass of wine</TARGET> while we waited.	positive	1.0	positive,positive
ABSA16-Z#6:12.2	For desserts, we tried the frozen black sesame mousse (interesting but not extraordinary) and <TARGET>matcha (powdered green tea) and blueberry cheesecake</TARGET>, which was phenomenal.	positive	1.0	positive
ABSA16-565344:1.1	This little place definitely exceeded my expectations and you sure get a lot of <TARGET>food</TARGET> for your money.	positive	1.0	positive
ABSA16-1632445:1.1	The <TARGET>menu</TARGET> is limited but almost all of the dishes are excellent.	negative	1.0	negative
ABSA16-1310217:2.2	The price is reasonable although the <TARGET>service</TARGET> is poor.	negative	1.0	negative,negative,negative
ABSA16-P#7:3.1	The <TARGET>food</TARGET> we ordered was excellent, although I wouldn't say the margaritas were anything to write home about.	positive	1.0	positive,positive
ABSA16-1090587:1.1	If you've ever been along the river in Weehawken you have an idea of the top of <TARGET>view</TARGET> the chart house has to offer.	neither	1.0	neither
ABSA16-1460715:0.1	Great <TARGET>pizza</TARGET> for lunch place.	positive	1.0	positive
ABSA16-1430994:3.1	My boyfriend had the <TARGET>New England Chowder</TARGET> it was good but I think the award should go to the Lobster Bisque.	positive	1.0	positive
ABSA16-430342:5.2	Even if the <TARGET>food</TARGET> wasn't this good, the garden is a great place to sit outside and relax.	negative	1.0	negative
ABSA16-1577714:3.1	Quite frankly, this is some of the worst <TARGET>sushi</TARGET> I have ever tried.	negative	1.0	negative,negative
ABSA16-1138996:1.2	We have been to this place many times, and always have great food, <TARGET>wine</TARGET>, and service.	positive	1.0	positive,positive
ABSA16-1476493:0.1	I thought this <TARGET>place</TARGET> was totally overrated.	positive	1.0	positive
ABSA16-1289424:2.1	After really enjoying ourselves at the <TARGET>bar</TARGET> we sat down at a table and had dinner.	positive	1.0	positive,positive
ABSA16-1486041:2.1	Despite a slightly limited <TARGET>menu</TARGET>, everything prepared is done to perfection, ultra fresh and a work of food art.	negative	1.0	negative
ABSA16-1710746:1.1	I would recommend Roxy's for that, but not for their <TARGET>food</TARGET>.	negative	1.0	negative
ABSA16-Z#3:2.2	I paid just about $60 for a good <TARGET>meal</TARGET>, though :)	positive	0.6666666666666666	positive,neither,positive
ABSA16-BHD#7:0.2	amazing fresh dogs but best of all endless <TARGET>toppings</TARGET>!!!	positive	1.0	positive,positive
ABSA16-746254:4.2	With so many good restaurants on the UWS, I don't need overpriced food, absurdly arrogant <TARGET>wait-staff</TARGET> who don't recognize they work at a glorified diner, clumsy service, and management that doesn't care.	negative	1.0	negative
ABSA16-1496205:1.1	The <TARGET>location</TARGET> and ambience is Ok but the food is what makes up for it.	positive	1.0	positive
ABSA16-1380450:1.1	The <TARGET>hanger steak</TARGET> was like rubber and the tuna was flavorless not to mention it tasted like it had just been thawed.	negative	1.0	negative
ABSA16-1728733:2.2	She was very helpful in suggesting us drinks and helped us in ordering a lot of good <TARGET>dishes</TARGET> since we knew nothing about Indian food.	positive	1.0	positive
ABSA16-404464:2.3	The entree was bland and small, <TARGET>dessert</TARGET> was not inspired.	negative	1.0	negative
ABSA16-490565:2.3	The food is yummy, especially their cooked-to-perfection mussels in spicy tomato sauce and their shoestring crispy <TARGET>fries</TARGET>.	positive	1.0	positive
ABSA16-WE#4:1.1	My daughter's wedding reception at <TARGET>Water's Edge</TARGET> received the highest compliments from our guests.	positive	1.0	positive,positive
ABSA16-WE#4:2.2	Everyone raved about the atmosphere (elegant <TARGET>rooms</TARGET> and absolutely incomparable views) and the fabulous food!	positive	1.0	positive,positive
ABSA16-BFC#9:18.3	Everyone seemed generally happy with their food, except my brother who had the <TARGET>grilled Mahi Mahi</TARGET>, seemingly drenched in Grapfruit Juice! 	negative	0.5	negative,neither
ABSA16-521916:1.2	Small servings for main entree, i had salmon (wasnt impressed) girlfriend had <TARGET>chicken</TARGET>, it was good.	positive	1.0	positive
ABSA16-1004293:0.1	Judging from previous posts this used to be a good <TARGET>place</TARGET>, but not any longer.	negative	1.0	negative,negative
ABSA16-1726427:1.7	We are very particular about sushi and were both please with every choice which included: ceviche mix (special), crab dumplings, assorted sashimi, sushi and rolls, two types of <TARGET>sake</TARGET>, and the banana tempura.	neither	1.0	neither
ABSA16-1432551:0.2	Go to Volare for 1st class service and terrific <TARGET>food</TARGET>.	negative	0.5	negative,positive
ABSA16-720620:4.2	Try the congee and the donut like deep fried dough they call <TARGET>Ow Ley Soh</TARGET>, a delicious and sweet tasting bread.	positive	1.0	positive
ABSA16-BFC#7:3.2	Each time we've been, the <TARGET>front of house staff</TARGET> (not the waiters - they're fantastic - but the people who greet and seat you) has been so hideous to us that were it not for the exceptional fish dishes I would never return. 	positive	1.0	positive
ABSA16-TR#3:2.1	<TARGET>Place</TARGET> is open till late, no dress code.	negative	0.5	negative,neither
ABSA16-1719567:1.3	My husband said he could've eaten several more, the portion was fine for me he even exclaimed that the <TARGET>french fries</TARGET> were the best he has had.	positive	1.0	positive
ABSA16-NP#4:0.1	Maggot in the <TARGET>food</TARGET>!	negative	1.0	negative,negative
ABSA16-1439875:1.3	The <TARGET>place</TARGET> is small and intimate and you may feel a little crowded, but the service is excellent and it's great for friends out, a romantic date, or a special occassion.	negative	1.0	negative
ABSA16-1632929:4.1	When my dessert came, there was a candle in it - not because anyone asked for one - but because the <TARGET>waiter</TARGET> must have seen me opening my birthday card and gift, and said he knew it was a special occassion of some sort.	positive	1.0	positive
ABSA16-Z#7:0.1	This <TARGET>place</TARGET> doesn't make any sense	negative	1.0	negative,negative
ABSA16-1367358:1.1	The <TARGET>food</TARGET> is authentic Italian - delicious!	positive	1.0	positive
ABSA16-624715:4.2	Just straight up cheap, good <TARGET>food</TARGET>.	positive	1.0	positive
ABSA16-1609375:1.2	We love the food, <TARGET>drinks</TARGET>, and atmosphere!	positive	1.0	positive,positive
ABSA16-Y#9:4.1	They have a delicious <TARGET>banana chocolate dessert</TARGET>, as well as a great green tea tempura.	positive	1.0	positive
ABSA16-1102681:1.1	This tiny <TARGET>restaurant</TARGET> is as cozy as it gets, with that certain Parisian flair.	positive	0.6666666666666666	positive,positive,neither
ABSA16-1162037:0.1	Planet Thailand has always been a hit with me , I go there usually for the <TARGET>sushi</TARGET>, which is great , the thai food is excellent too .	positive	1.0	positive,positive,positive
ABSA16-1126886:2.3	The service is excellent, the decor is great, and the <TARGET>food</TARGET> is delicious and comes in large portions.	positive	1.0	positive
ABSA16-PP#4:4.2	I thought the <TARGET>restaurant</TARGET> was nice and clean.	positive	1.0	positive
ABSA16-1606837:1.1	With the theater 2 blocks away we had a delicious <TARGET>meal</TARGET> in a beautiful room.	positive	1.0	positive
ABSA16-1353599:0.2	Right off the L in Brooklyn this is a nice cozy <TARGET>place</TARGET> with good pizza.	positive	1.0	positive
ABSA16-1471273:3.1	Prices too high for this cramped and unappealing <TARGET>resturant</TARGET>.	negative	1.0	negative
ABSA16-1723658:1.2	Great food, good size <TARGET>menu</TARGET>, great service and an unpretensious setting.	positive	1.0	positive,positive
ABSA16-1632445:6.3	The <TARGET>lobster sandwich</TARGET> is $24 and although it was good it was not nearly enough to warrant that price.	negative	1.0	negative
ABSA16-426930:0.2	Authentic <TARGET>Taiwanese food</TARGET> that's cheap... what more could you ask for?	positive	1.0	positive,positive
ABSA16-498657:4.2	The wait here is long for dim sum, but if you don't like sharing tables or if the typical raucous dim sum <TARGET>atmosphere</TARGET> is not your gig, this is a sleek (for Chinatown) alternative.	negative	1.0	negative
ABSA16-Z#5:1.1	Mazing <TARGET>interior</TARGET>.	positive	1.0	positive
ABSA16-Y#5:2.1	<TARGET>Chicken teriyaki</TARGET> had tomato or pimentos on top??	neither	1.0	neither,neither
ABSA16-461928:1.2	The pizza is delicious and the <TARGET>proprietor</TARGET> is one of the nicest in NYC.	positive	0.6666666666666666	positive,positive,neither
ABSA16-1410878:1.1	I've never had bad <TARGET>service</TARGET> and the fish is fresh and delicious.	positive	1.0	positive
ABSA16-NP#4:4.2	I showed it to the <TARGET>manager</TARGET>, and he smilingly apologized and brought us two free desserts (but did not ask us what we wanted and so brought the last two desserts we would have asked for).	positive	0.6666666666666666	negative,positive,positive
ABSA16-BG#5:4.4	I have it a 4 instead of 5 because of the price (just chicken tikka masala - no bread of rice - is $25), which I would expect at a upscale Indian restaurant but this place doesn't have an upscale <TARGET>feel</TARGET>.	negative	1.0	negative,negative
ABSA16-CLF#3:23.2	I would not expect this for a $55 <TARGET>dinner</TARGET>.	negative	1.0	negative
ABSA16-1352948:0.1	The place is a BISTRO which means: simple <TARGET>dishes</TARGET> and wine served efficiently in a bustling atmosphere.	negative	0.5	negative,positive
ABSA16-FF#4:3.1	The <TARGET>servers</TARGET> at Flatbush Farm appear to have perfected that ghastly technique of making you feel guilty and ashamed for deigning to attract their attention.	positive	1.0	positive
ABSA16-EVPK#10:2.2	I LOOOVE their eggplant pizza, as well as their <TARGET>pastas</TARGET>!	positive	1.0	positive
ABSA16-1286916:3.1	It's simply the best <TARGET>meal</TARGET> in NYC.	positive	1.0	positive
ABSA16-1707741:2.1	The <TARGET>food</TARGET> was average or above including some surprising tasty dishes.	positive	1.0	positive
ABSA16-757762:0.2	Baluchi's has solid food and a nice <TARGET>decor</TARGET> at reasonable prices.	positive	1.0	positive
ABSA16-519425:1.1	The <TARGET>baked clams octopus</TARGET> we shared as appetizers were the best we've ever had!! 	positive	1.0	positive
ABSA16-1349391:1.2	sometimes i get bad food and bad <TARGET>service</TARGET>, sometimes i get good good and bad service.	negative	0.5	negative,neither
ABSA16-536919:1.1	The only thing the <TARGET>waiters</TARGET> don't do for you is wipe your chin when you leave.	positive	1.0	positive
ABSA16-FF#6:6.1	The only thing that my friend left out is that when we sat down at the bar the <TARGET>bartender</TARGET> disappeared.	negative	1.0	negative
ABSA16-TR#2:1.2	Service ok but unfriendly,filthy <TARGET>bathroom</TARGET>.	negative	1.0	negative,negative
ABSA16-1500453:3.1	Whether it's the <TARGET>parmesean porcini souffle</TARGET> or the lamb glazed with balsamic vinegar, you will surely be transported to Northern Italy with one bite.	positive	1.0	positive
ABSA16-BG#6:1.1	<TARGET>Decor</TARGET> needs to be upgraded but the food is amazing!	positive	1.0	positive
ABSA16-737999:5.1	<TARGET>Yakitori (bbq meats)</TARGET> is tasty too.	positive	1.0	positive,positive
ABSA16-1726473:0.1	Average to good <TARGET>Thai food</TARGET>, but terrible delivery.	neither	1.0	neither
ABSA16-1338124:4.1	I have reservations about the <TARGET>all you can eat deal</TARGET>, however -- the choices are fairly limited and you can probably order more food than you can eat for less than $18 by just going off the menu.	negative	1.0	negative
ABSA16-1632445:4.1	The only fallback on this <TARGET>restaurant</TARGET> is the prices.	positive	0.5	positive,negative
ABSA16-1700205:1.1	From the spectacular <TARGET>caviar</TARGET> to the hospitable waitstaff, I felt like royalty and enjoyed every second of it.	positive	1.0	positive,positive
ABSA16-1189674:1.2	The food was amazing, and the <TARGET>service</TARGET> was prompt and helpful, but not over-bearing or rushed.	positive	1.0	positive,positive
ABSA16-Y#3:0.1	Best. <TARGET>Sushi</TARGET>. Ever.	positive	1.0	positive
ABSA16-1609375:3.1	Try the <TARGET>Pad Thai</TARGET>, it's fabulous and their prices are so cheap!	positive	1.0	positive
ABSA16-TM#6:5.2	Even though the place is not beautiful, the <TARGET>food</TARGET> speaks for itself.	positive	1.0	positive
ABSA16-BFC#9:22.1	<TARGET>Service</TARGET> not the friendliest to our "large party"! 	negative	1.0	negative,negative
ABSA16-1126814:3.1	Decent <TARGET>wine</TARGET> at reasonable prices.	positive	1.0	positive
ABSA16-ADLT#8:2.1	Great <TARGET>food</TARGET>.	positive	1.0	positive,positive
ABSA16-1623276:0.2	Patroon features a nice cigar bar and has great <TARGET>staff</TARGET>.	positive	1.0	positive
ABSA16-1225162:4.1	The <TARGET>bar</TARGET> is very well stocked with interesting beers and well priced wines.	positive	1.0	positive,positive
ABSA16-1726427:3.1	Definitely a great <TARGET>spot</TARGET> for a nice occasion or date.	positive	1.0	positive
ABSA16-Z#10:2.2	The food was great and tasty, but the <TARGET>sitting space</TARGET> was too small, I don't like being cramp in a corner.	neither	1.0	neither
ABSA16-Y#7:2.1	The <TARGET>sashimi</TARGET> is always fresh and the rolls are innovative and delicious.	positive	1.0	positive
ABSA16-490565:6.1	You can't go wrong with this <TARGET>place</TARGET>.	positive	1.0	positive
ABSA16-1126814:0.4	Leon is an East Village gem: casual but hip, with well prepared basic French bistro fare, good specials, a warm and lively <TARGET>atmosphere</TARGET>.	positive	1.0	positive
ABSA16-1064477:0.1	I tend to judge a sushi restaurant by its <TARGET>sea urchin</TARGET>, which was heavenly at sushi rose.	positive	1.0	positive
ABSA16-BFC#7:3.1	Each time we've been, the front of house staff (not the <TARGET>waiters</TARGET> - they're fantastic - but the people who greet and seat you) has been so hideous to us that were it not for the exceptional fish dishes I would never return. 	negative	0.5	negative,positive
ABSA16-1398844:7.1	To be completely fair, the only redeeming factor was the <TARGET>food</TARGET>, which was above average, but couldn't make up for all the other deficiencies of Teodora.	neither	1.0	neither
ABSA16-1404042:5.1	One of us actually liked the <TARGET>expresso</TARGET> - that's it.	positive	0.5	positive,neither
ABSA16-Z#6:4.2	It’s just you and your date and an occasional cute ‘excuse me’ before the <TARGET>waiter</TARGET> opens the little curtain to your booth!	reject	0.5	reject,neither
ABSA16-1470334:3.2	They have a huge selection of different <TARGET>cream cheeses</TARGET> and all of their salads are great.	positive	1.0	positive
ABSA16-444818:1.2	The atmosphere is unheralded, the <TARGET>service</TARGET> impecible, and the food magnificant.	positive	1.0	positive
ABSA16-1660047:0.1	I like Cafe Noir dont get me wrong, it is jsut that the <TARGET>people</TARGET> who work there are evil and incompetent!!	negative	1.0	negative,negative
ABSA16-1626564:0.1	LLOOVVE THIS <TARGET>PLACE</TARGET>.	positive	1.0	positive,positive
ABSA16-555734:0.1	I really liked this <TARGET>place</TARGET>.	positive	1.0	positive,positive,positive
ABSA16-1387314:1.2	This is my first time writing a review for a restaurant because the food and <TARGET>service</TARGET> was excellent.	positive	1.0	positive
ABSA16-CLF#4:10.1	This <TARGET>place</TARGET>...god where do i begin.	positive	1.0	positive
ABSA16-BHD#4:5.1	Only complaint is the pricing--I believe it would be more reasonable to pay a dollar less on each item listed on the <TARGET>menu</TARGET>.	negative	1.0	negative
ABSA16-475512:2.1	Well, this <TARGET>place</TARGET> is so Ghetto its not even funny.	reject	1.0	reject
ABSA16-1713185:0.2	This <TARGET>place</TARGET> is really trendi but they have forgotten about the most important part of a  restaurant, the food.	positive	1.0	positive
ABSA16-1623276:2.1	This is a nice <TARGET>restaurant</TARGET> if you are looking for a good place to host an intimate dinner meeting with business associates.	positive	1.0	positive
ABSA16-1126886:2.1	The <TARGET>service</TARGET> is excellent, the decor is great, and the food is delicious and comes in large portions.	positive	1.0	positive
ABSA16-507937:2.2	Spreads and <TARGET>toppings</TARGET> are great - though a bit pricey.	positive	1.0	positive
ABSA16-DBG#7:9.1	The <TARGET>side dishes</TARGET> were passable, and I did get a refill upon request.	positive	0.5	positive,neither
ABSA16-397331:3.1	Not only is the <TARGET>cuisine</TARGET> the best around, the service has always been attentive and charming.	positive	1.0	positive,positive
ABSA16-757762:5.1	There is no excuse for such lousy <TARGET>service</TARGET>!	negative	1.0	negative,negative
ABSA16-Z#5:6.2	Despite the confusing <TARGET>mirrors</TARGET> this will likely be my go-to for modern Japanese food for the foreseeable future.	negative	1.0	negative
ABSA16-BHD#8:1.2	At first glance this place seems a bit pricey for a hot dog joint, but at Bark you don't just get your average <TARGET>hot dog</TARGET>.	negative	1.0	negative
ABSA16-1289424:0.1	We had a great time at the <TARGET>Jekyll and hyde Pub</TARGET> last night.	positive	1.0	positive
ABSA16-1125006:1.2	Best Pastrami I ever had and great <TARGET>portion</TARGET> without being ridiculous.	positive	1.0	positive,positive
ABSA16-1609375:2.2	The svc can be a bit rude at times, esp if you have big group, but overall the <TARGET>restaurant</TARGET> is a must!	positive	1.0	positive
ABSA16-1404042:1.1	Not one of our <TARGET>meals</TARGET> was edible - bland and/or made with weird rosemary or orange flavoring.	negative	1.0	negative
ABSA16-720418:1.1	The <TARGET>owner</TARGET> truly caters to all your needs.	positive	1.0	positive
ABSA16-FF#3:23.3	The manager came to the table and said we can do what we want, so we paid for what we did enjoy, the drinks and <TARGET>appetizers</TARGET>, and walked out.	positive	0.5	positive,neither
ABSA16-657129:3.1	the <TARGET>drinks</TARGET> are amazing and half off till 8pm.	positive	1.0	positive
ABSA16-NP#10:2.2	Great food, amazing <TARGET>service</TARGET>, this place is a class act.	positive	1.0	positive
ABSA16-682391:0.2	Best drumsticks over rice and <TARGET>sour spicy soup</TARGET> in town!	positive	0.5	positive,reject
ABSA16-535248:1.2	The shrimp scampi was excellent and the <TARGET>antipasti</TARGET> were plentiful.	positive	1.0	positive
ABSA16-1632445:1.2	The menu is limited but almost all of the <TARGET>dishes</TARGET> are excellent.	positive	1.0	positive
ABSA16-Z#5:3.1	I've had my fair share of <TARGET>modern Japanese</TARGET> and this spot delivers.	neither	1.0	neither
ABSA16-1053543:3.2	The spicy tuna roll was unusually good and the <TARGET>rock shrimp tempura</TARGET> was awesome, great appetizer to share!	positive	1.0	positive
ABSA16-Y#4:3.1	The <TARGET>Seafood Dynamite</TARGET> is also otherworldly.	positive	1.0	positive
ABSA16-1655504:4.2	<TARGET>Wine list</TARGET> is extensive without being over-priced.	negative	1.0	negative
ABSA16-397331:1.1	While their <TARGET>kitchen food</TARGET> is delicious, their Sushi is out of this world.	positive	1.0	positive
ABSA16-541532:0.1	Cozy romantic <TARGET>atomosphere</TARGET> with only around 15 tables at most.	positive	1.0	positive
ABSA16-512925:2.2	also it's great to have dinner in a very romantic and confortable place, the <TARGET>service</TARGET> it's just perfect...they're so frendly that we never want to live the place!	positive	1.0	positive,positive
ABSA16-720620:6.1	<TARGET>Service</TARGET> is not what you are coming here for...	negative	1.0	negative
ABSA16-610611:1.3	stick with the chicken, beef, and <TARGET>lamb dishes</TARGET>.	positive	1.0	positive,positive
ABSA16-TFS#5:21.2	I read reviews that called the <TARGET>restaurant</TARGET> too expensive and I thought to myself, but may be it is worth it.	neither	1.0	neither,neither
ABSA16-1016296:1.1	Ive asked a <TARGET>cart attendant</TARGET> for a lotus leaf wrapped rice and she replied back rice and just walked away.	neither	1.0	neither
ABSA16-558423:5.1	Quick and friendly <TARGET>service</TARGET>.	positive	1.0	positive
